{
  "schemaVersion":1,"format":"embeddedknowledge-assessment-v1","lessonId":"PREM-QNT-006","lessonVersion":"0.1.0","assessmentId":"assessment-logarithms-change","title":"Logarithms and exponential change mastery gate","purpose":"mastery-gate","attemptPolicy":{"retakeable":true,"timeLimitMinutes":null,"feedback":"after-attempt"},
  "items":[
    {"id":"item-log-translation","type":"single-choice","sceneId":"scene-synthesis","objectiveIds":["objective-translate-log"],"outcomeIds":["topic-quantitative-foundations-logarithms"],"prompt":"Which statement is equivalent to log base 3 of (1/27) = -3?","points":2,"responseSpec":{"mode":"single-choice","options":[{"id":"option-translate-a","text":"3⁻³ = 1/27"},{"id":"option-translate-b","text":"(-3)³ = 1/27"},{"id":"option-translate-c","text":"27⁻³ = 3"},{"id":"option-translate-d","text":"3^(1/27) = -3"}]},"answer":{"correct":"option-translate-a","summary":"The base raised to the logarithm value equals the argument.","reasoning":"The inverse definition gives 3 to the power -3 equals 1/27.","acceptableResponses":[],"commonErrors":["Using the logarithm value as the base","Swapping base and argument"]},"rubricId":"rubric-log-translation","safetyCritical":false},
    {"id":"item-log-laws","type":"short-answer","sceneId":"scene-synthesis","objectiveIds":["objective-use-log-laws"],"outcomeIds":["topic-quantitative-foundations-logarithms"],"prompt":"Expand ln(5x³/y²) for x > 0 and y > 0.","points":4,"responseSpec":{"mode":"text","maxLength":800},"answer":{"correct":"ln 5 + 3 ln x - 2 ln y","summary":"Use product, quotient, and power laws.","reasoning":"The product becomes a sum, the quotient a difference, and exponents become coefficients.","acceptableResponses":[],"commonErrors":["Splitting a sum that is not present","Dropping exponent coefficients","Adding the denominator term"]},"rubricId":"rubric-log-laws","safetyCritical":false},
    {"id":"item-solve-exponential","type":"short-answer","sceneId":"scene-synthesis","objectiveIds":["objective-solve-exponential"],"outcomeIds":["topic-quantitative-foundations-logarithms"],"prompt":"Solve 3e^(0.4t) = 21. Give t to three decimal places and check by substitution.","points":5,"responseSpec":{"mode":"text","maxLength":1200},"answer":{"correct":"e^(0.4t) = 7, so 0.4t = ln 7 and t = ln 7/0.4 ≈ 4.865. Substitution gives 3e^(0.4×4.865) ≈ 21.","summary":"t ≈ 4.865.","reasoning":"The exponential factor is isolated before applying the natural logarithm to both positive sides.","acceptableResponses":["4.865"],"commonErrors":["Taking ln before dividing by 3 and then splitting a sum","Multiplying by 0.4 instead of dividing"]},"rubricId":"rubric-solve-exponential","safetyCritical":false},
    {"id":"item-domain","type":"single-choice","sceneId":"scene-synthesis","objectiveIds":["objective-translate-log","objective-use-log-laws"],"outcomeIds":["topic-quantitative-foundations-logarithms"],"prompt":"Over the reals, what is the domain of f(x) = ln(x - 4)?","points":3,"responseSpec":{"mode":"single-choice","options":[{"id":"option-domain-a","text":"x ≥ 4"},{"id":"option-domain-b","text":"x > 4"},{"id":"option-domain-c","text":"x ≠ 4"},{"id":"option-domain-d","text":"All real x"}]},"answer":{"correct":"option-domain-b","summary":"The logarithm argument must be strictly positive.","reasoning":"x - 4 > 0 implies x > 4; zero is not an allowed real logarithm argument.","acceptableResponses":[],"commonErrors":["Allowing argument zero","Excluding only the single zero point while allowing negative arguments"]},"rubricId":"rubric-domain","safetyCritical":false},
    {"id":"item-half-life","type":"short-answer","sceneId":"scene-synthesis","objectiveIds":["objective-interpret-change"],"outcomeIds":["topic-quantitative-foundations-logarithms"],"prompt":"A fictional exponential signal is 12.5% of its initial value after 18 hours. Under an exact half-life model, find the half-life and explain without decimal logarithms if possible.","points":5,"responseSpec":{"mode":"text","maxLength":1200},"answer":{"correct":"12.5% = 0.125 = 1/8 = (1/2)³, so 18 hours contains three half-lives and h = 18/3 = 6 hours.","summary":"The half-life is 6 hours.","reasoning":"Recognizing the exact power of one half makes the unknown exponent visible without approximation.","acceptableResponses":[],"commonErrors":["Treating a 12.5% remaining fraction as a 12.5% decrease","Dividing 18 by 8"]},"rubricId":"rubric-half-life","safetyCritical":false},
    {"id":"item-transfer-decay","type":"open-response","sceneId":"scene-synthesis","objectiveIds":["objective-translate-log","objective-solve-exponential","objective-interpret-change"],"outcomeIds":["topic-quantitative-foundations-logarithms"],"prompt":"A fictional process follows P(t) = 450e^(-0.12t), with t in hours. Find when P reaches 90, determine the model's half-life, state the domain conditions used in taking logarithms, and verify both results numerically.","points":8,"responseSpec":{"mode":"text","maxLength":2800},"answer":{"correct":"For P = 90, the positive dimensionless ratio is 90/450 = 0.2. Thus e^(-0.12t) = 0.2 and t = -ln(0.2)/0.12 ≈ 13.412 h. For half-life, e^(-0.12h) = 0.5, so h = -ln(0.5)/0.12 = ln 2/0.12 ≈ 5.776 h. Checks: 450e^(-0.12×13.412) ≈ 90 and e^(-0.12×5.776) ≈ 0.5. Both log arguments are positive ratios.","summary":"Threshold time ≈ 13.412 h; half-life ≈ 5.776 h.","reasoning":"Each target is divided by the positive initial value, then the natural logarithm inverts the exponential after its positive dimensionless ratio is isolated.","acceptableResponses":[],"commonErrors":["Using a positive exponent despite decay","Taking ln of dimensional P without forming a ratio","Confusing the time to 20% with the half-life"]},"rubricId":"rubric-transfer-decay","safetyCritical":false}
  ],
  "rubrics":[
    {"id":"rubric-log-translation","title":"Inverse translation","criteria":[{"id":"criterion-translate","description":"Maps base, exponent, and argument correctly.","maxPoints":2}]},
    {"id":"rubric-log-laws","title":"Logarithm laws","criteria":[{"id":"criterion-expand","description":"Uses product, quotient, and power laws to obtain the complete expansion.","maxPoints":4}]},
    {"id":"rubric-solve-exponential","title":"Exponential equation","criteria":[{"id":"criterion-isolate-log","description":"Isolates the exponential and applies ln correctly.","maxPoints":2},{"id":"criterion-solve-time","description":"Obtains t ≈ 4.865.","maxPoints":2},{"id":"criterion-check-time","description":"Substitutes into the original equation.","maxPoints":1}]},
    {"id":"rubric-domain","title":"Real logarithm domain","criteria":[{"id":"criterion-domain","description":"Requires x - 4 > 0 and selects x > 4.","maxPoints":3}]},
    {"id":"rubric-half-life","title":"Exact half-life reasoning","criteria":[{"id":"criterion-half-power","description":"Recognizes 0.125 as three factors of one half.","maxPoints":3},{"id":"criterion-half-time","description":"Obtains and labels 6 hours.","maxPoints":2}]},
    {"id":"rubric-transfer-decay","title":"Exponential decay transfer","criteria":[{"id":"criterion-transfer-ratios","description":"Forms positive dimensionless ratios for both targets.","maxPoints":2},{"id":"criterion-transfer-threshold","description":"Obtains about 13.412 hours.","maxPoints":2},{"id":"criterion-transfer-half","description":"Obtains about 5.776 hours.","maxPoints":2},{"id":"criterion-transfer-checks","description":"Verifies both results and states positivity/domain conditions.","maxPoints":2}]}
  ]
}
